{
  "$schema": "../../schemas/history-month.schema.json",
  "month": 6,
  "year": 2026,
  "title": "June 2026",
  "description": "Draft scaffold for a curated Month in History Wall import for June 2026.",
  "status": "draft",
  "layoutSeed": "2026-06-v1",
  "events": [
    {
      "slug": "fifa-world-cup-2026-kicks-off",
      "title": "FIFA World Cup 2026 Kicks Off",
      "summary": "The FIFA World Cup 2026 opened on June 11, 2026, at Mexico City Stadium.",
      "context": "The tournament was hosted across Canada, Mexico, and the United States, expanding the geographic footprint of football's largest event.",
      "whyItMatters": "The World Cup is one of the world's most-watched sporting events and made June 2026 a defining month for global football.",
      "category": "Sports",
      "date": "2026-06-11",
      "location": "Mexico City, Mexico",
      "countries": ["Mexico", "Canada", "United States"],
      "relevanceScore": 96,
      "media": {
        "kind": "image",
        "url": "/media/placeholders/history-event.svg",
        "alt": "Suggested image: Mexico City Stadium or FIFA World Cup 2026 official imagery.",
        "caption": "The FIFA World Cup 2026 began in Mexico City.",
        "credit": "LOCAL_PLACEHOLDER",
        "license": "LOCAL_PLACEHOLDER"
      },
      "detailMarkdown": "The FIFA World Cup 2026 kicked off on June 11 at Mexico City Stadium.\n\nFIFA's schedule placed the tournament across Canada, Mexico, and the United States, making it a major transnational sports and media event throughout June and July.",
      "sources": [
        {
          "title": "FIFA World Cup 26 match schedule revealed",
          "url": "https://www.fifa.com/en/tournaments/mens/worldcup/canadamexicousa2026/articles/fifa-world-cup-26-match-schedule-revealed",
          "publisher": "FIFA",
          "sourceType": "official",
          "notes": "Confirms opening date, opening venue, host nations, and final date."
        }
      ]
    }
  ]
}
